{
  "id": "deepseek-r1",
  "name": "DeepSeek-R1",
  "family": "deepseek",
  "release_date": "2025-01-20",
  "open_weights": true,
  "tool_call": false,
  "reasoning": true,
  "structured_output": false,
  "modalities": {
    "input": ["text"],
    "output": ["text"]
  },
  "limit": {
    "context": 131072,
    "output": 8192
  }
}
