{
  "id": "qwen3-max",
  "name": "Qwen3-Max",
  "family": "qwen",
  "open_weights": true,
  "tool_call": true,
  "reasoning": true,
  "structured_output": true,
  "modalities": {
    "input": [
      "text"
    ],
    "output": [
      "text"
    ]
  },
  "limit": {
    "context": 262144,
    "output": 131072
  }
}
