{
  "id": "doubao-2.1-pro",
  "name": "豆包 2.1 Pro",
  "family": "doubao",
  "open_weights": false,
  "tool_call": true,
  "reasoning": true,
  "structured_output": true,
  "modalities": {
    "input": ["text", "image"],
    "output": ["text"]
  },
  "limit": {
    "context": 262144,
    "output": 16384
  }
}
