{
  "id": "deepseek-v3",
  "name": "DeepSeek-V3",
  "family": "deepseek",
  "release_date": "2024-12-26",
  "open_weights": true,
  "tool_call": true,
  "reasoning": false,
  "structured_output": true,
  "modalities": {
    "input": ["text"],
    "output": ["text"]
  },
  "limit": {
    "context": 131072,
    "output": 8192
  }
}
