{
  "id": "deepseek-v4-flash",
  "name": "DeepSeek-V4-Flash",
  "family": "deepseek",
  "open_weights": false,
  "tool_call": true,
  "reasoning": true,
  "structured_output": true,
  "modalities": {
    "input": ["text"],
    "output": ["text"]
  },
  "limit": {
    "context": 1048576,
    "output": 393216
  }
}
