{
  "id": "glm-5.2",
  "name": "GLM-5.2",
  "family": "glm",
  "release_date": "2026-06-01",
  "open_weights": false,
  "tool_call": true,
  "reasoning": true,
  "structured_output": true,
  "modalities": { "input": ["text"], "output": ["text"] },
  "limit": { "context": 1048576, "output": 131072 }
}
