{
  "id": "doubao-2.1-turbo",
  "name": "豆包 2.1 Turbo",
  "family": "doubao",
  "open_weights": false,
  "tool_call": true,
  "reasoning": false,
  "structured_output": true,
  "modalities": {
    "input": ["text"],
    "output": ["text"]
  },
  "limit": {
    "context": 131072,
    "output": 8192
  }
}
