{
  "id": "ernie-speed-pro",
  "name": "ERNIE Speed Pro",
  "family": "ernie",
  "open_weights": false,
  "tool_call": true,
  "reasoning": false,
  "structured_output": true,
  "modalities": {
    "input": ["text"],
    "output": ["text"]
  },
  "limit": {
    "context": 131072,
    "output": 4096
  }
}
